,song_id,emotion_1,emotion_2,emotion_3,key_sentence
6706,3808189,6,4,11,say can call you my
6707,4646570,3,17,18,곳에 꽃이 피네 꽃이 피네
6708,4641331,9,10,18,살아 너는 나만한 사람
6709,4630408,6,4,3,너의 손과 don catch me
6710,4633163,4,3,17,oh oh stop stop 깊어진
6711,4585736,11,18,15,be bad bad say why
6712,4614200,3,4,18,울고있는 알게 사랑해도 너무나
6713,4616854,3,8,11,사라지는 사랑이 사랑이 기대
6714,4641392,4,6,17,잠도 못들고 오늘따라 잠도 못들고
6715,4646588,1,4,16,슬픔이 엇갈리고 좌절과 용기가 교차되고
6716,4649655,8,5,3,목소리 다시 나를 흔들어
6717,4618647,8,3,11,나의 가슴은 사람조차 신기루 하늘
6718,4643534,3,7,14,너에게 닿으면 은근히 기분
6719,4640746,8,2,13,so baby love never felt
6720,4660909,10,9,7,상냥하게 만들어 마치 심장 위에
6721,4671151,5,18,13,입술로 어서 나를 죽이고 나는
6722,4665220,11,12,18,사랑 amor 감정을 설명하는 단어는
6723,4674167,5,11,16,우린 헤어졌다 만났다
6724,4666402,3,4,18,내가 만든 노래
6725,4681146,3,6,20,so sweet yum 오늘
6726,4665107,8,3,15,안았던 너잖아 떠날 거라면 끝인거라면
6727,4667457,1,5,17,되뇌이며 우는 나를
6728,4677133,3,8,17,새로운 사랑 시작해도 괜찮아 웃으며
6729,4656602,1,18,15,뜨거웠던 사랑은 점점 꽃잎처럼 물들어
6730,4674344,8,5,12,hug me 따뜻한 눈빛으로
6731,4650421,1,2,16,better call tyron please leave
6732,4671153,8,5,13,yo what up baby girl
6733,4649342,4,6,3,못해 세상 어둠은 눈부신 니가
6734,4671152,3,8,11,jump in my car go
6735,4674336,3,8,12,우리의 행복과 아픔들을 내려놓는 헤어짐은
6736,4686392,3,4,17,why you leave me alone
6737,4649637,11,13,17,다시 사랑할 없다면 전화하지
6738,4650279,6,3,15,걷다가 뛰다 꿈처럼 사라져가고 비가
6739,4688674,1,2,16,안돼 서로 흠만 잡아 오늘은
6740,4686952,3,12,11,to give is more precious
6741,4648495,3,5,7,많은 사람들 중에 나만 혼자
6742,4691117,1,3,18,가끔 어딘가 떠나가고 싶어
6743,4656370,10,9,0,love is nightmare
6744,4658842,5,13,16,you shake it hey boy
6745,4674351,3,17,18,몰라 아직 사랑
6746,4654324,3,8,2,누구보다 아파아파 나를 미치도록 비틀비틀
6747,4650488,1,15,12,거야 땀은 삐질 삐질 더워
6748,4671154,18,12,13,body you got that body
6749,4693165,2,18,11,봐요 이제 어떡해요
6750,4671156,3,18,15,아직도 사랑한다고 말하고 싶었지만
6751,4665158,3,15,11,안돼 혼자만 많이 다른 사람일까
6752,4669783,5,6,18,너란 사람 관심 thank
6753,4650438,1,4,17,운명이라는 말을 처음으로
6754,4684703,8,2,11,colors you know why cuz
6755,4692825,4,3,1,잔인한 계절은 나를
6756,4663033,3,4,19,웃을 있을까 너와 where am
6757,4667349,3,14,17,making me smile 짜증나는 하루
6758,4671157,1,12,16,내가 이기적인 내가 나를 조금씩
6759,4669789,3,8,16,사랑일까요
6760,4674337,8,5,13,woo fancy you woo 이미
6761,4706174,7,2,1,누구보다 너를 사랑해 baby 생긴
6762,4711065,3,4,6,cry 그대는 머리위에 우산
6763,4714217,1,12,15,누군가를 그리워하는 사람들이 많습니다 지금도
6764,4723861,7,8,11,너도 나와 같다면 여자는 여자는
6765,4711007,8,5,13,주면 사랑일까 이런 사랑일까 어떡해
6766,4734486,8,1,12,싶어 call me your darling
6767,4721314,1,5,12,켜져 그것은 red light
6768,4734489,4,7,18,나를 좋아한다면 사랑한다면 let
6769,4749449,2,8,17,여기 명수네 떡볶이 일단 먹고
6770,4722450,6,18,13,지난날들 오늘만을 두근대며 기다렸어 급하면
6771,4729593,7,14,11,사람 같지가 않아 사랑이 사랑
6772,4756304,5,6,11,touch my body know you
6773,4691278,5,1,12,ma moo 거기 mr 애매모호
6774,4751624,1,15,13,이제 헤어져 헤어져
6775,4591400,1,15,12,album members seasons representer poptime
6776,4711120,2,8,15,me see your body move
6777,4749304,6,1,15,old thing and the game
6778,4749620,2,11,18,dance girl like the way
6779,4724122,3,4,18,사랑하는데 움직이지마
6780,4706588,6,5,1,big fan 이라고 말하고 전화기
6781,4729579,6,10,13,so good girl you
6782,4690053,3,4,8,너무 소중한 사람이 지금 아파하는데
6783,4727298,8,3,7,아침의 세상은 나른하지만 끓는 누가
6784,4729598,15,11,12,목소리 음악은 타임머신 추억이 쌓이듯이
6785,4743081,8,17,11,좋네 건들지마 solo solo day
6786,4709050,8,13,17,사랑을 혼자하기엔 너무 아파 얼마나
6787,4697864,1,15,18,so stop fronting know you
6788,4729578,4,17,13,아침이면 일어나
6789,4703371,3,17,14,훗날엔 baby 너와의 기억은 baby
6790,4764928,9,10,0,baby all yours jesus 무슨
6791,4727317,1,7,18,night 너의 색깔로 나를
6792,4756411,10,9,3,can you save me save
6793,4756305,5,8,2,too fast 습관처럼
6794,4713839,5,6,14,fly away just like trust
6795,4736613,8,12,17,순간 슬퍼하고 잊을 텐데 나는
6796,4789747,7,5,12,계란 정말 피곤해 남들처럼
6797,4806686,5,8,3,dat baby don worry 너란
6798,4771771,6,15,11,립스틱을 바른 나는 빨개요
6799,4779294,3,4,18,사랑을 받아 줄수 있겠니 나를
6800,4793898,3,14,18,사랑하지 않을까
6801,4800614,5,1,16,shit about me 운발로 올라간
6802,4821170,8,7,3,love you 귓가에 속삭인다 그대는
6803,4806687,3,4,8,노래가 끝나 수록 맘은 무너지고
6804,4762446,10,9,13,나의 사랑 운명 이죠
6805,4821171,5,12,11,감정이 나는 너무나 좋아요
6806,4832150,7,11,14,사회 찌질이들은 여자들이 성형하녜
6807,4793764,7,5,11,꼴레리 rap battle도 못해본 놈들이
6808,4814576,5,6,1,go hard go go go
6809,4774996,5,17,18,bold just rock the world
6810,4806688,6,5,18,빌어 사람이 가지 않게 항상
6811,4810612,3,4,18,눈물만큼 그대 행복하길 쯤은 나를
6812,4754435,8,13,12,fall in love 지금 타고
6813,4803842,3,18,14,아아아아아 in love 자꾸 나를
6814,4828024,5,18,11,luv woah turn up 분위기는
6815,4821175,5,8,16,너를 찾아요 그대는 모르겠지만 몸은
6816,4843704,3,14,18,꿈속에 니가
6817,4840373,3,5,8,swear promise you baby 오직
6818,4764927,7,1,12,맞춘 matt tone의 fashion like
6819,4806689,6,1,17,임마 what up 걔가
6820,4785802,8,3,14,네가 있어 나는 좋았지
6821,4782193,6,1,5,do ain nobody love you
6822,4788387,7,15,12,oh oh oh 예쁜 여자들이
6823,4806735,5,18,17,different 네가 원하는 남자완 달라
6824,4821172,3,17,18,나랑 잔만
6825,4774767,8,2,15,하지 말고 alright girl
6826,4821176,6,5,7,사랑한단 말조차 부족할 때가 있지만
6827,4779217,8,13,14,무언가가 사랑이었다는걸 눈물이 말을
6828,4785684,3,4,18,하루만 편히 너를 사랑하고 싶어
6829,4788410,3,4,1,사랑했다 아꼈었다 뿐이다 사랑하다 미워진
6830,4806691,3,8,7,나를 너에게 주고 싶어 baby
6831,4782649,8,13,14,너만을 사랑해 심장이 원해 운명
6832,4818649,13,15,11,cherish me 멈추지마 hit the
6833,4800528,13,11,14,that you love me 너도
6834,4796459,6,1,12,sailing on my dreams roll
6835,4800500,1,2,0,sing along one more time
6836,4806690,7,8,11,굳었어 너의 대화명이 지워지고 프로필
6837,4016085,3,15,14,너도 어디선가 나처럼 울까
6838,5372667,14,11,17,뜯었어 그래서 나는 돈하지 않아
6839,4743560,1,2,15,night stand be damned cupid
6840,4854588,8,2,1,that remix right here my
6841,5376645,5,2,17,seen man like me 거침없이
6842,4230004,3,14,17,cry 영원히 행복하길 good bye
6843,4743562,8,2,1,you want man of passion
6844,5388806,3,14,16,말은 말아요 사랑의 눈빛만을 주세요
6845,4743561,4,6,13,so sad laugh when you
6846,4854446,10,9,13,날씨가 너무 좋아 마치 우리
6847,4743571,8,12,15,worth here comes the train
6848,5381331,6,3,4,baby 너무 빠르진 않게 달빛이
6849,5387875,1,12,14,나는 눈에 힘주고 니가
6850,4743564,2,1,18,night stand be damned cupid
6851,4743565,6,5,18,see happiness in this town
6852,5383102,8,2,3,you are ready for fast
6853,4857978,8,1,12,owwww baby preying on you
6854,5375532,3,8,17,어떻게 없이 사랑할 있나요
6855,4743569,8,11,15,the street found song that
6856,4828190,1,12,17,거야 너와 나의 love fiction
6857,5390701,6,1,15,boom boom boom clap 내꺼
6858,4743566,8,2,15,you have cursed me when
6859,5394265,1,2,18,out let me go 몸에
6860,4868481,1,2,18,꿈을
6861,4864206,9,10,17,그리워서 외로워져 이게 무슨 일일까
6862,5375679,1,2,17,너의 향기에
6863,4818613,6,15,13,정말 사랑한다면 숨기지 말기 나처럼
6864,4824874,6,13,0,위에서 네게 말해요 love you
6865,5389475,3,4,18,라면땅에 새벽마다 퇴근하신 아버지 주머니를
6866,4743572,2,6,11,please dont see just boy
6867,5383100,3,14,18,추억이 되면 가끔 안부
6868,4865030,12,11,18,star you got be stronger
6869,5376632,5,7,16,oh love you 들리니
6870,4853295,1,16,15,슈퍼맨이라도 기대하고 있니 이만하면
6871,4743574,8,2,15,my mind when baby you
6872,5379383,8,13,15,느꼈죠 아직도 두눈이 너를 기억해
6873,5400360,3,11,18,서로 사랑했던
6874,5408681,3,18,12,시간은 흐르듯이 흘러가고 추억이란 댐을
6875,5401276,3,8,16,설레었죠 나는 한숨도 잤죠
6876,5415175,10,9,0,묻는 사이 바로 직전이 우리의
6877,5421427,5,1,12,죽을 같다가도 미워서 죽일 듯이
6878,5406682,4,13,16,걱정 해도 너만
6879,5402092,10,9,18,떠난 이에게 노래 하세요 후회없이
6880,5400358,3,8,12,나였을까 누가 먼저
6881,5413256,1,5,2,기다렸다며 사랑 반겼던 너는 이제
6882,5386171,3,4,17,나만 혼자 남아
6883,5421429,5,8,11,있을까 무슨 생각해
6884,5413548,8,17,15,me why 눈을 감으면
6885,5400356,8,7,13,아래 들리는 숨소리와 나의 심장소리
6886,5397393,3,14,17,이렇게 남아 서있다 잊혀질 만큼만
6887,5402720,5,1,18,웃음소리가 나의 방을 울리네 차가운
6888,5400365,3,7,4,무력했지 슬픔을 보듬기엔 내가 너무
6889,5400357,3,6,18,서로의 꿈들에 함께 부풀었었고
6890,5408662,7,11,15,내가 있어 yes can remember
6891,5421434,8,1,15,who said love is sweet
6892,5421428,6,1,17,where your pocket is baby
6893,5401393,8,12,14,그저 just friends 네가 원했듯이
6894,5408677,3,8,16,설렜죠 나는 그날 한숨도 잤죠
6895,5402473,8,3,2,그랬잖아 서로가 서로의 마지막 사랑일
6896,5414970,11,16,18,check and verify 왜냐하면 산타가
6897,5400359,5,11,0,사랑도 때가 되면 느나요 조금
6898,5421433,2,1,18,음악은 프로포폴 10년간 니들 머리
6899,5392777,1,5,16,태어난 여자 따뜻한 너의 사랑을
6900,5406933,2,1,15,wo wo wo oh baby
6901,5406903,3,6,18,너와 나의 마지막 만남이야 갑자기
6902,5400362,3,17,18,너를 생각해 마음은 언제나 자리
6903,5424619,3,17,16,바람은 놀리듯
6904,5394280,1,12,18,쏟아지는 나의 눈물이 하루 종일
6905,5421435,2,8,11,nothing can save me you
6906,5400361,5,11,18,수수께끼 언제나 조각 모자라는 퍼즐처럼
6907,5408541,4,3,8,그대로였어 let me breathe 피할
6908,5442688,8,11,12,miss me did you diss
6909,5442687,1,2,16,나는 그땐
6910,5442696,8,13,12,last time your love no
6911,5442689,7,18,12,쉬고 있어 그냥 울지마 웃지마
6912,5456526,3,4,18,눈물을 멈춰줄게 don play me
6913,5442691,1,2,18,힘든 세상 속에 혼자
6914,5458267,3,17,11,뒤돌아 네가 있을까 자리에서 매일
6915,5442690,1,7,18,lovely time youtube에서도 빛낼
6916,5465008,5,7,18,우리 처음 만난
6917,5439395,3,17,16,너와 있던 시간이 항상 생각
6918,5442692,3,4,18,네가 익숙해 친구 같은 눈물은
6919,5442697,8,6,15,see me break up 나보다
6920,5456521,5,8,2,어딜 봐도 the pretty girls
6921,5442693,3,5,11,놀이 지쳐가네 what could do
6922,5442694,5,8,12,leave me alone it not
6923,5470838,1,2,18,la am good boy am
6924,5465067,3,4,18,궁금해 네가 정말 좋은가 잠이
6925,5459290,4,13,11,맙소사 그대 그대 나의 귓가에
6926,5442698,5,8,13,사랑은 마음을 물들여요 낯선 공간에서
6927,5474213,5,18,17,꼬마가 어느새 담을 넘는다 언덕
6928,5431090,2,1,0,술인데 니가 떠난 후에 하루도
6929,5473905,8,1,6,속에서 my love 점점
6930,5442699,1,17,18,삶의 그리움과
6931,5442695,8,2,11,away from my heart
6932,4840271,5,2,11,흔들흔들흔들흔들 hey baby boy
6933,5462666,8,4,7,no 착한 doo doo
6934,5445196,3,4,17,그대 닦아 준다면 그대의 외로움
6935,5450271,4,16,13,수고 많으셨어요 어떻게 지내셨나요 오늘도
6936,5431071,4,3,18,혼자 자리에만 남아
6937,5473834,6,5,11,멈춰줄래 너는 너무 빨리 가는
6938,5464998,9,20,12,good bye moon 다가오는 크리스마스에는
6939,5430793,3,19,12,봄볕처럼 처음처럼 다시 내게 꿈처럼
6940,5465068,10,9,0,뜨는 거였다면 지금의 직업은 파일럿
6941,5464978,8,7,13,목소리 번씩 갈라져도 위해
6942,5465066,8,17,13,조용한 바다 서늘한 바람이 분다
6943,5465096,1,5,12,하루 아무렇지도 않나요 나는요 나는요
6944,5470601,1,6,13,어린 아들놈을 유난히 무겁게 흐르는
6945,5466964,3,16,17,영화는 막을 내렸는데 우리는 어제도
6946,5458192,7,5,12,말야 첫눈예보 타이밍이 맞아 예뻐
6947,5413257,6,1,18,있을까 한참을 달리고 달리면 나는
6948,5457853,3,8,4,울고싶은 날엔 보고싶은 날엔
6949,5495296,3,14,18,외롭다 내가 존재하는 이유는
6950,5482636,3,6,14,헤어지지만 우리 사랑을 우리 사랑을
6951,5495681,5,17,11,love you you cause you
6952,5476552,3,4,18,언젠가는 매일 너의 사진들을 확인하는
6953,5493729,1,7,12,쌓인 눈을 뽀독
6954,5489152,2,5,18,안아줄래 첫눈을 닮은 my love
6955,5486885,5,11,12,모든 질문들의 준비돼있어 young king
6956,5478283,3,14,18,다시 사랑한다면 좋을
6957,5480966,6,18,13,한번쯤은 그대의 눈에 눈물을 닦아
6958,5504874,3,4,17,어쩔 없는 마음이
6959,5482064,3,4,18,못할 사랑입니다
6960,5497052,6,5,11,마치 마치 어젯밤 안녕처럼 아닌
6961,5484485,1,2,16,엄마도
6962,5482819,8,13,12,후에 나는 삶을 잃어버렸어
6963,5472103,5,1,2,some action are you ready
6964,5488945,3,1,17,be snow 아직 사랑해 christmas
6965,5487104,2,8,5,주제 it time to go
6966,5497218,8,13,14,sleigh bells ring are you
6967,5503377,6,5,13,네가 오늘 따라
6968,5493719,3,1,18,말대로 너를 미워
6969,5503347,7,3,8,뭔가 낯설고 익숙하진 않아도 그래서
6970,5473907,8,5,17,사랑해 사랑해 들리지 않는
6971,5511223,3,9,20,싶어 그게 정말 너일까
6972,5511318,4,11,13,하나뿐인 사람 내겐 꿈꾸듯 보물
6973,5531227,1,17,12,mad soul child fire trouble
6974,5536206,3,18,17,목소리 사랑한다는 말이 익숙해질 즈음
6975,5533607,2,7,5,deja boo singing stay oh
6976,5551234,3,7,18,따뜻한 사랑을
6977,5555751,6,11,13,사랑한다고 말도 못하면서 그만 울라니까
6978,5546828,6,11,17,다가와서 나를 안아요 스르륵 잠이
6979,5526865,7,11,18,가빠져서 악몽 속에 살아 죄책감일까
6980,5528069,5,11,12,ya coach for ya girl
6981,4660794,8,3,12,believe you let me down
6982,1032761,8,2,15,눈처럼 순수한 사랑 white
6983,5523079,5,11,18,자꾸 더해도 해도
6984,5555752,3,14,18,사랑 우리 봄날에 추운
6985,5545022,8,2,1,깨워 끔찍했던 기억 저편에서 마주했었고
6986,5526770,3,1,16,너를 잊어 마음
6987,5531377,3,8,15,너를 바라보며 한참 동안 바보처럼
6988,5536249,3,6,8,생각이 나서 많이 보고
6989,5551724,3,7,8,머릿속엔 온통 baby all need
6990,5538220,8,1,2,세상이란 바구니 작은 행복이란
6991,5515390,5,16,11,불빛에 살며시 웃음을 지으며 나무
6992,5538271,6,17,15,같아 she making me crazy
6993,5526863,10,9,0,바라봐줘요 fall in love 그대만을
6994,521722,3,14,17,사랑 그보다 행복한 내겐 없었어
6995,5546791,8,4,1,머리를 떠나 눈물
6996,5557985,3,4,15,친구도 오늘은
6997,5576417,1,8,12,기억들을 꿈처럼
6998,5572312,3,14,15,혼자서 어쩌구 사실 나는
6999,5584400,3,1,4,걷어 후회를 반복 사랑은 미친
7000,5584641,8,15,12,나도 내가 미친
7001,5567464,9,10,0,너만 사랑할 나일
7002,5582180,2,1,17,party like pay day 앞에선
7003,4857981,8,12,11,down need your loving
7004,5562520,5,7,12,예뻐 너만 보면
7005,5554059,3,14,0,그날
7006,5552430,5,13,11,drama 어색해진 우리 사이
7007,5459268,2,1,18,hot hot damn say my
7008,5549372,5,3,8,my love 요즘 이상하다
7009,5552200,3,18,14,나만의 사랑 그대를
7010,315872,8,7,3,행복을 없었어 그런데 사랑을
7011,5562500,4,3,6,너의 꿈들을
7012,5562748,8,12,11,뚜루루루루루루루 흘러 내리는 빗물은 슬픔으로
7013,5576267,3,17,12,나는 잠도 들어 순간도 잊을
7014,5595472,8,1,2,너의 달콤한 기억들 이제 이상
7015,5582684,6,18,15,싫어 나를 네게
7016,5546489,8,15,11,걱정됐나요 달빛에 반짝이는 이슬처럼 사라질
7017,5566596,10,6,13,달콤한 너의 목소리로
7018,5570018,7,2,1,꿈꾸던 소녀 행복한
7019,5587009,1,6,15,here we go hey shake
7020,5599020,6,5,11,하지만 사랑하고 사랑한다 사랑 그게
7021,5608760,10,9,3,빌어먹을 날씨도
7022,5578668,8,11,13,without you with my love
7023,5610343,5,8,17,머리카락 상태는 엉망 흐트러진
7024,5616999,5,1,0,all ready 모두들 준비됐어 준비됐어
7025,5622359,6,5,20,girl movin too fast 여기서
7026,5629186,2,1,19,차가웠던 겨울에 하얀 눈도 스르륵
7027,5628083,2,8,17,사랑이 아닌 사랑들을 해요
7028,5610623,7,8,13,dawn do you feel me
7029,5620321,1,2,18,paradise here yours 이것만
7030,5617748,8,13,12,girl did you get text
7031,5610344,5,2,18,사랑은 부서진다 마치 남의 이야기
7032,5629148,7,5,2,종소리가 울리지 la la la
7033,5600224,8,5,13,깊은 어둠도 침묵도 이젠 너를
7034,5593327,1,15,12,love is incomplete the story
7035,5612295,1,18,17,come take my hand 말라버린
7036,5642918,3,4,17,계속 움직이게 눈물이 나는 아무도
7037,5612284,5,8,13,만난 너의 기억보단 조금 빠른
7038,3360476,3,8,14,언젠가 잊혀져 노래만 불렀어
7039,5610945,3,4,8,사랑했던 우리는 없어 언제부터인지
7040,5627962,3,18,17,하지만 나도 여자예요 baby 나도
7041,5639931,6,8,14,너의 마음을 말하다 운다
7042,5644620,2,5,13,boom what up hey girl
7043,5612384,8,1,5,이제 아무 느낌
7044,5644636,5,12,11,baby baby 다른 남자 말고
7045,5637019,6,5,14,쉬기도 하고 번씩 번씩 생각난대도
7046,5658708,7,2,15,이렇게 키우셨니 shake that booty
7047,5652555,18,14,12,your light 너의 눈을 보면
7048,5660040,1,2,18,don do that 답할 없어
7049,5657052,6,14,18,to monday 끊지 우리의 짧았던
7050,5657227,10,9,13,아직도 사랑해 ooh mi
7051,5674119,8,13,17,me and you sing
7052,5650996,9,3,18,왼손은 지금까지도 너의 향기가 미묘하게
7053,5661710,2,7,18,gotta keep it one hunnit
7054,5653958,8,3,7,어느새 또다시 눈부신 봄이야 봄바람처럼
7055,5647454,5,8,2,yeah halo my
7056,5653497,6,1,14,젊음과 영감과 느낌 계속 오래
7057,5647453,4,16,13,타샤의 검은 행복이 나를 위로
7058,5644827,4,3,6,잔인한 queen 아름다움 가시
7059,5644829,5,6,11,당연한 play you know what
7060,5646004,7,8,13,몰라도 아무렇지 않아 나는 babe
7061,5657054,8,7,15,baby say it true 오늘은
7062,5667583,3,18,17,아무것도 몰랐잖아 너를 힘들게 했다는
7063,5657053,10,9,15,머리 세웠어 지갑을 녹색으로 채웠어
7064,5644828,4,6,17,el dorado 험난한 여정
7065,5644826,1,6,15,말했어 the answer is you
7066,5674470,5,8,7,안아줄래요 아직까지 믿겨요 마음이 보이나요
7067,5655276,8,3,12,지금 빗소릴 듣고 있을까 밖에
7068,5658744,1,17,12,my heart going
7069,5647802,3,14,18,너와 만든 기념일마다 슬픔은 나를
7070,5629279,8,12,15,been long day without you
7071,5672392,5,3,20,미소에 마음이 녹아내려 눈이 마주쳤을
7072,5644825,4,6,3,갖고 너를 보고 있는 서로
7073,5644824,6,3,17,girl 쉽지 않아
7074,5647847,9,10,18,나를 찾아와 따스한 봄바람
7075,5682700,2,1,18,양아치 거울 속에 just loser
7076,5684826,7,16,15,경찰 불러 babe baby
7077,5684914,1,4,6,heart is running to you
7078,5700639,8,13,11,머금고 있다면 그건 울림이 생긴다면
7079,5702706,6,15,18,정말 사랑해요 배고플
7080,5681153,5,13,11,니가 나한테 이럼 니가 모든
7081,5668985,8,5,13,네가 너무 그리워 네가 너무
7082,5690596,7,8,3,수가 없어 want you back
7083,5700879,5,11,13,다운 view 너무 아름다운 다운
7084,5690942,3,7,11,흘린눈물 모두 닦아줄게 너의 외로움도
7085,5683227,3,16,15,지내니 오늘도 바보처럼 우리 헤어진
7086,5704765,8,7,3,홀로 앉는다 잔을 너로 채우고
7087,5674616,1,16,13,애석하게도 너는 아직 순진한 똥개
7088,5683329,7,11,18,we all celebrate you 행복하길
7089,5684197,2,1,7,탓한다 침묵하는 것이 익숙하고 편해졌어
7090,5686285,5,1,17,눈에 네가 비쳐 살짝 빠져가
7091,5692770,10,9,12,bubble 나도 너를 너를 너를
7092,5678250,3,7,18,wanna reset wanna reset 어둠에
7093,5690598,9,10,18,눈물로 하염없이 너를 기다리는
7094,5684893,5,1,12,나도 완벽하진 않아
7095,5704397,5,8,13,궁금해서 잠이 그때 그랬어 구차해도
7096,5672768,3,8,11,웃음 짓고 돌아서면 진짜 웃기지도
7097,5688499,5,8,17,니가 처음이야 니가 처음이야 baby
7098,5692635,8,2,5,다가가고 싶어지는 외면하려 하면 할수록
7099,5700878,5,7,12,너무 따뜻해 love sick girl
7100,5719286,2,1,14,못하게 남자들의 품위
7101,5719287,2,1,14,위험해 aye man you better
7102,5721440,6,0,0,달려가볼까 yea yea yea
7103,5717521,6,4,13,떠나기 싫은 나의 하루 종일을
7104,5731852,9,10,18,good bye 안녕 안녕
7105,5748499,5,8,12,me shake it shake
7106,5721441,6,8,15,세련되진 않지만 tender love baby
7107,5709750,3,16,17,사랑은 소리 없이
7108,5748406,3,5,17,빨개져 이해 못해 네가 걔를
7109,5725591,7,2,5,your style follow
7110,5743804,5,8,13,않겠어 오늘은 달라 먼저 다가가
7111,5742255,9,10,3,soul my song my love
7112,5731941,7,8,12,아리고 아프다 너도 나처럼
7113,5721453,8,7,13,사랑한다고 지금처럼
7114,5708377,6,4,11,야박해 gotta love urself more
7115,5721449,15,18,11,사랑이야기 나의
7116,5710257,5,7,1,심장에 shoot it out 찌릿
7117,5738546,5,7,18,take her to my house
7118,5709755,5,8,13,부끄럽지만 나의 손을 잡아
7119,5710000,6,5,11,나는 기도합니다 그대를 위해 기도합니다
7120,5697094,9,20,11,마음이 마냥 기쁨 만이기를 바래
7121,5721554,3,4,18,새사람 만나기로 했어 사람 너처럼
7122,5742256,5,17,13,star show off your white
7123,5715541,3,18,15,love 나처럼 이렇게 웃자 하나둘씩
7124,5715381,1,18,15,시절 it so beautiful day
7125,5709752,3,4,18,be with you 어제보다
7126,5740235,6,3,14,can you feel my
7127,5713758,3,18,12,모습이야 이건 다른 연인들처럼 눈을
7128,5740262,8,3,6,혼자서 너의 꿈을
7129,5721454,1,5,16,yi ge ye wan jiang
7130,1509829,3,4,18,손꼽을까요 이미 사랑은 너무 커져
7131,5721652,16,18,11,우리 꿈결 같았던 시간은 끝난
7132,5713422,4,3,1,child before and we play
7133,5760115,3,8,5,잊어야
7134,5385974,4,3,18,비잉비잉 돌아가는 세상도 나를 비웃듯이
7135,5760116,2,11,17,없어 맨정신이 제일 싫어
7136,5768980,2,8,11,party we gon rock rock
7137,5771304,4,17,13,air all my ladies hands
7138,5767424,2,11,18,ring my bell 쿵쾅 거리는
7139,5713425,7,1,12,to downtown deserve to go
7140,5781104,3,12,18,느껴지는 순간 do you remember
7141,5779688,1,18,15,생각만 해도 비극
7142,5765885,3,17,14,사랑하면 할수록 멀리 떠나가도록 스치듯
7143,5756880,4,6,11,목소리 oh 내가 있는 노래
7144,5748398,8,13,11,사랑하고 혼자 이별하고 혼자
7145,5785424,10,3,14,친구야 미안해 오늘 내가 바쁜
7146,5767582,2,1,8,bad betting on you
7147,5765888,7,3,8,눈으로 나를
7148,5765887,8,11,15,하진 않을까 세월에 닫혀진 우리의
7149,5385973,6,5,11,look back in bitterness going
7150,5752316,1,2,18,이해 불가능 oh music video에서
7151,5758243,8,17,13,벗어나지마 oh baby johnny
7152,5756651,8,5,3,니가 있었기에 나조차
7153,5765886,3,8,11,불빛만이 가득한 슬픈
7154,5761969,5,2,11,거니 어쩌라는 거니 stop stop
7155,5713426,6,3,11,새벽 그림자 사이에
7156,5763962,5,8,13,니가 잊었을까봐 니가 잊었을까봐 누가
7157,5779813,9,10,18,so beautiful girl 너는
7158,5794982,1,5,16,거짓말로 속이지 물론 나도
7159,5748500,8,2,1,일어나기 싫어 너무 재미있는
7160,5775671,3,5,6,묶어주는 너에겐 쉬운 내겐 슬픈
7161,5777833,18,14,13,dj pumkin 1989 내가 태어난
7162,5793206,9,8,10,서로 쳐다본 다음 웃음만 짓네
7163,5713423,6,13,14,여겼더니 달은 열심히 떠올라 보름달을
7164,5781346,1,6,12,oh baby
7165,5748401,3,17,18,망설였다면 baby girl 그냥 나와
7166,5785421,5,1,6,먼저 니가 떠올릴 사람
7167,5807274,3,16,18,말아요 내일은 모르잖아요 하지만 만은
7168,5807273,7,2,8,yea baby give me
7169,5804238,5,8,13,같아 woo baby feel you
7170,5826461,5,7,16,me 레옹 call me call
7171,5815785,6,5,11,1998 당시 고향은 힙합 불모지
7172,5824839,5,6,11,무한대를 그려봐 let go boom
7173,5818522,10,6,5,괜찮아 baby let ride
7174,5826462,2,8,7,woo baby yeah dance oh
7175,5826465,8,2,13,이런 도둑이 들었네 holy mama
7176,5826447,7,3,15,몰랐었어 외로웠고 문득
7177,5811228,3,16,15,uh 예술가는 못해 나이값 철드는
