,song_id,emotion_1,emotion_2,emotion_3,key_sentence
2208,288419,8,17,15,why didn come left you
2209,530124,5,3,11,아려와 너의 사진이 점점 흐려져
2210,526174,8,17,12,you gave me that kiss
2211,537749,3,4,16,기억에 행복하지 못하면
2212,526177,8,12,11,like we re dead was
2213,539887,3,15,18,안타까운 꿈들 다시 계절이 온것처럼
2214,603081,9,10,17,축복할꺼야 너는 하나님의
2215,536359,3,4,16,want you hear want you
2216,315228,3,6,20,주여 우리의 죄악 용서하소서 이땅
2217,622778,5,8,12,아하 솔직히 말해 머리 굴리지
2218,503278,8,15,13,won let you trick me
2219,521805,4,3,18,아파오고 聞こえない 胸の吐息 키코에나이 무네노토이키
2220,539458,17,18,11,어찌 믿겠니 삐형이지 너의 생각으로만
2221,536964,3,14,18,사랑하니까 없이 살아가야 한다는 것은
2222,521797,1,12,17,reach your roses carried away
2223,539148,3,11,16,울지않도록 영원히 그리움
2224,482954,8,2,15,you got me so crazy
2225,532450,1,12,18,나는 그대만의 여자로
2226,619581,10,13,19,예수님 사랑합니다 아주 많이요 사랑합니다
2227,602461,8,11,15,황당해 하며 모두들 나에게 되물었지만
2228,536421,1,14,18,when the dj playin our
2229,601398,6,3,4,어떡해 어떡해 어떡해 마음을 향기로운
2230,354635,11,12,18,he was boy she was
2231,515938,2,11,17,靑色の深くに沈みたい どこまでも果てなく夜空をまとい 新しい世界を探そう 會いたくて會えなくて搖れまどうけれど 目覺めた翼は消せない
2232,601056,4,11,17,주님 나를 이끄소서 주님
2233,466105,8,11,15,stuck on you now love
2234,602665,6,5,11,oh danny boy the pipes
2235,519761,5,14,13,소토노쿠우키니 쿠비와오히카레 보쿠와 세오무케타 시로쿠
2236,373255,5,11,12,seem like crush but it
2237,603245,4,3,18,한번이라도 내가 먼저 사랑했단 이유
2238,521785,5,4,13,히토미와 히카리우세타 모에쿠루우 코코로와 아야츠레나이
2239,605274,3,7,8,주믿는 성도들에게 큰사랑 베푸사 우리의
2240,530960,3,4,1,사랑이 있었다는걸 나는 그리워해 그렇게
2241,623250,4,13,17,아침이면 일어나
2242,623902,3,14,17,함께 있는 것만으로 눈물이 나는
2243,623157,3,18,17,말할까 사랑하고 있다고 한번만 먼저
2244,622662,10,19,13,첨엔 몰랐을땐 이게 사랑인가
2245,631232,7,15,11,사랑의 노래를 불러
2246,623246,2,1,7,they do baby if they
2247,622742,8,5,11,사랑해요 거짓말처럼 당신을 사랑해요
2248,623903,7,13,11,이상 사랑할 없어
2249,623241,7,20,11,서로 너무 다르지만요 사랑은 신비로운
2250,632780,3,16,14,destiny you call it love
2251,623239,5,18,12,come on it my time
2252,623909,1,4,12,위해서 사랑해
2253,632779,2,7,11,해도 너를 떠올리며 거절했지만 이번
2254,642420,3,5,18,밤새 내린 하얀 눈에
2255,632788,8,16,11,이렇게 나는 너에게 내안에
2256,623485,3,4,18,너의 눈빛 나는 기억해
2257,533259,2,14,11,don tie me down love
2258,623904,3,4,16,매일 울어요
2259,529686,8,3,4,사랑해 니가 없다면
2260,623251,3,8,2,빌며 떠난 사랑인데 다시
2261,623927,3,14,17,나를 울릴 때면 너무 보고
2262,623248,3,8,14,느껴 얼마나 사랑했는지 너무 가까이
2263,623238,10,9,13,가는거야 멀리 정말 괜찮은 거지
2264,623243,4,6,17,그저 멍하니 바라봐 아름다워 너만이
2265,623240,3,14,18,누구나 사랑은 똑같은걸 결국엔
2266,623472,8,12,15,나를 사랑하게
2267,623905,3,18,12,있죠 느껴져요 감으면 울까요 여전히
2268,622443,2,7,15,more more about me gotta
2269,623153,8,3,15,이미 없는거야 forget my love
2270,622764,8,13,11,전하지 못했지만 사랑
2271,623906,8,4,3,더이상 사랑할수
2272,634613,5,1,16,없어 우리의 사랑을 아름다운 그녀가
2273,623242,1,8,2,그런데 이상하게도 후부터 니가 낯설지가
2274,623424,1,2,17,사랑한다 했지 사람도
2275,623244,18,15,11,지칠땐 너를 안아줄께 my babe
2276,638568,3,17,16,아무 말이라도 좋아 나를
2277,622776,8,5,12,ladies if want just shake
2278,623247,5,7,18,얻은 자유가 자유가 아니었어 답답함은
2279,623156,3,18,11,사랑한다고 말하고 싶은걸 사랑한다고
2280,632778,6,5,11,rainyday won last forever love
2281,623075,3,8,14,miss you and thank you
2282,623249,8,5,13,나의 한구석에 아직 너의 기억들을
2283,623155,4,16,17,따뜻하게 간직해 문을열어 하얀눈이와 온세상
2284,622774,17,18,12,break my heart
2285,623167,3,4,12,gonna make you go christmas에서
2286,534252,1,2,18,그래도 나는 행복하니까 언젠가 그녀를
2287,623141,8,3,4,she loves you 가지는 안을까
2288,632785,8,2,16,아무 수가 없지만 너를 사랑해
2289,621915,3,4,6,기억에 행복하지 못하면
2290,622660,8,13,17,죽는 날까지 너만 사랑할래 나는
2291,632786,1,2,17,사랑해 그대눈물까지도 모르지만 이젠 이해할수
2292,623154,3,8,17,숨어서 나는 너를 보고 싶었어
2293,632784,13,11,18,없이 찾아드는 기다림 사랑의 시작
2294,623907,10,16,13,sun comes up 나를 알지
2295,602432,4,2,3,나도 웃고 머리를 살며시 매만져
2296,623130,7,5,8,you re my destiny babe
2297,638571,1,3,18,내게 그랬나요 지금까지도 나는 아직까지도
2298,623910,3,18,14,슬픈 나의 사랑은 이제
2299,622669,1,17,12,너라면 바보같이 굴지마 슬프거나 괴롭거나
2300,623066,8,15,12,why am so real but
2301,623245,1,2,18,안돼 눈에 흙이 들어가기 전에는
2302,665226,3,4,18,홀로 애태우는 이자리 두뺨엔 비바람만
2303,667278,3,4,17,나의 고백이 너무
2304,667794,6,8,13,언젠가 한번은 가야 길이라고 생각해
2305,665221,3,14,17,젊음도 사랑도
2306,665220,2,1,8,떠난 스쳐가는 지난 일들을 비처럼
2307,670684,3,7,18,마음 아닐까 까치발로 달빛
2308,686651,8,12,11,나를 두고 가지마 나를
2309,531840,13,14,18,love you so much forever
2310,686637,7,3,15,my love 어젯밤
2311,686649,8,3,4,이제는 너무 사랑해
2312,602302,3,18,15,웃음도 버린
2313,665222,3,14,17,없이 서로를 믿어요 어리숙하다 해도
2314,665231,3,4,18,나의 눈에 고인 눈물방울
2315,632790,3,14,18,destiny you call it love
2316,633409,8,2,11,all ma dj mc rock
2317,642427,10,9,0,your kisses in your hugs
2318,642426,3,4,18,세상은 난너여야만 용서해 나를 슬픔
2319,686652,3,8,1,사랑하고싶어
2320,622664,9,10,0,산속에도 바다속에도 이렇게 행복할
2321,665224,8,13,12,the sad cafe remember
2322,672045,4,7,18,예상한적없는데 하루하루 사랑이 깊어갈수록 느낄수
2323,686650,1,18,12,그리고 외쳐봐요 난난난난 자유로와 생각
2324,665225,3,4,18,가을 하늘에 편지를 잊혀져 꿈들을
2325,657254,8,11,12,그녀를 불태웠던 니가 피할 사람이
2326,642277,8,3,14,addicted to the lovin that
2327,667279,3,4,17,나의 고백이 너무
2328,665228,3,7,18,여름밤의 그대는 모습을 마음을
2329,665223,2,16,11,soul flight soul flight back
2330,686653,9,10,18,이쯤에서 사랑해도 되니 아주
2331,642419,8,5,13,들리는 파도소리 따라서 나는 영원히
2332,632219,4,11,13,눈이 꽃잎처럼 내려와 우리의 사랑
2333,698972,3,1,18,슬픔의 말이었던 눈물이 이제는 그립다는
2334,708213,3,4,17,멀어지나요 그대의 눈물은 자꾸
2335,684946,3,15,18,희망은 없어도 달빛은 남는 밤도
2336,708701,5,1,18,였어 나의 모든 사랑은 운명은
2337,711627,3,8,17,놓아줄게 내가 없는게 행복한 너라면
2338,698973,3,4,17,수록 아파서 울죠 어떡하죠 정말
2339,698971,4,3,1,슬픔에 너와의 사랑이
2340,623161,8,3,14,tonight yeah drop it shake
2341,703745,8,17,15,me you set my spirit
2342,711626,3,17,18,울다가 울다가 울다가 지칠
2343,720528,8,3,7,잊혀져가는너의기억이 다시생각날까 너의마음속으로 들어가 볼수만있다면
2344,698975,3,18,15,다시 와야해요 미안해요 don cry
2345,720153,8,3,12,니가 많이 미웠어 미웠어 혼자
2346,691435,2,1,18,이뤄질수 없다고 해도 마음
2347,727900,3,18,14,사랑 하나 잊는
2348,696849,6,3,8,몰랐어 너를보며 노래를 부른다는게 조금은
2349,698979,5,6,3,자꾸 욕심이 나요 누군가를 사랑
2350,708211,8,12,11,꽃을 놓고 가는 마음은 시들지
2351,708215,3,4,17,기억이 무성하기만한 슬픈 세상엔 아나요
2352,698976,8,7,3,사랑해서 너무 미안해 질때 너는
2353,698974,3,4,8,stay with me tonight 마음을
2354,721553,10,9,13,영원한 사랑할래
2355,698978,8,3,11,미안해요 사람의 사랑받으며 살고
2356,708212,7,6,5,그대를 사랑했는데
2357,623750,2,8,3,breath hah hah can you
2358,711628,1,18,13,흘리지 않아 눈에 사는 너니까
2359,698977,9,10,13,즐겁겠어 이상 우울한 나는
2360,677883,1,2,16,my rap tell valet
2361,711630,3,17,18,할수있는 일이란 이것뿐 언제나 먼곳에
2362,698980,7,18,15,묻는 사람들 기침처럼 사랑은
2363,686655,1,18,12,나였다해도 너무
2364,670619,7,5,2,baby call my name 몰래
2365,711629,11,17,15,맨날 아파야했잖아 너를 사랑한 없다고
2366,698982,3,8,17,있게 keep my heart never
2367,708703,8,5,16,you adore can love is
2368,730864,10,1,16,심심해 our crew gonna 확실히drop
2369,698984,3,4,18,한순간 사라질 사랑이라면 시간은 오래
2370,698981,3,6,18,지겨웠던 월요일 서두는 태양에 그림자를
2371,622515,8,5,16,see you in my dreams
2372,698983,6,4,3,너보다 세월은 그저 거칠은 세상과
2373,708214,3,4,18,gonna love you forever need
2374,732512,1,7,12,나는 겁쟁이랍니다 조금씩 커져가는 사랑은
2375,733379,5,12,18,크게 외쳐봐 그댄 superstar woo
2376,742311,1,14,18,물어 이젠 사랑해도 사랑해선 안되고
2377,732513,7,3,8,사랑할 자격
2378,732373,3,17,16,사랑해 사랑해 잊으면
2379,728527,5,19,20,됐습니까 어젯밤 속에 날개 천사가
2380,732515,4,3,8,나를 용서해요 아파선
2381,705329,8,2,11,boy saw you
2382,732524,3,4,17,아파지나 사랑했다면 나를 사랑하긴 했다면
2383,775130,4,7,13,사랑이 아직도 내겐 남아 있지만
2384,736604,2,1,18,검은낙타 유할라
2385,732514,1,7,18,my life 너를 사랑해
2386,731087,2,1,18,do ya feel this
2387,728541,1,2,18,you my love for side
2388,732518,3,8,16,없었다고 말해요 옛사랑 궁금해 한다면
2389,672010,3,1,4,사랑했다는 너와 나눈 사랑은 삶보다
2390,732320,8,3,11,get right with me
2391,711631,3,18,14,가고 사랑도
2392,733357,7,4,18,용서할께 너를 만나
2393,634612,3,18,0,우정이란 내게 닮아가는 나만의
2394,737513,6,5,11,그걸 놓쳤더라면 너만 보면 나도
2395,711632,7,3,4,너를 잊은 살순 없지만
2396,775164,3,18,14,어떻게 잊겠니 너무 사랑하는데
2397,732519,4,3,8,잊으려하면 수록 아파와
2398,732516,3,6,4,your melody 나는 떠날래 어린왕자
2399,732522,10,9,13,슬픈 나의 바램 시간이
2400,711633,8,2,1,told you bye say
2401,731220,8,6,14,soul swing swing swing my
2402,730967,8,13,14,me smile mr player 내품에
2403,732520,2,1,4,삶의 오직 나만의 길을
2404,711635,8,3,5,사랑에 떠날거라면 기억을 조금씩
2405,711634,10,9,0,ll sing in my life
2406,711636,1,2,18,그래야 한다고 위로해보지만 포기하는 내겐
2407,732517,8,1,12,가슴 시원해질 때까지 funny rock
2408,827216,9,3,20,내가 사는지 궁금해도
2409,827215,6,1,15,될까요 des
2410,775161,8,3,15,않네요 내가 사랑한 사람 나보다
2411,833665,8,6,3,않고 움직이질 않겠대 내가 아파
2412,827894,7,1,14,슬픔 주러 다가온 이별을
2413,827785,3,4,17,차라리 죽을 만큼 외롭더라도 돌아보지마
2414,775191,8,11,14,사랑해서 사랑해서 헤어질
2415,833765,1,8,13,사랑했나요 그리 쉽게 없었던 일처럼
2416,823882,9,3,8,세월이란 믿음은 나에게만은 거꾸로 흘러
2417,775215,8,1,17,어둠 속에 영혼을
2418,711637,3,17,16,문자를 나의 마음속에서 너에게 보냈어
2419,827583,1,8,5,oh baby love you girl
2420,823828,7,2,14,모습이 보여 너의 사진에
2421,827218,3,8,11,내가 아는 한가지란 이것뿐 나는
2422,836973,8,3,2,joy that gave me 랄랄라라라라라라랄라라
2423,828123,3,7,14,슬픈 운명속에도 향해 가는 그리움
2424,828357,1,5,17,너는 내게 관심없어 하면서 자존심을
2425,833025,3,8,17,이제는 사랑한다고 얘기해도
2426,827217,5,2,8,rap 내리는 어느 오후 낯익은
2427,833026,3,14,17,서로 사랑해도 헤어진 주인공 핑계
2428,742429,6,5,13,사랑만을 원해 어떡해야
2429,827116,4,11,13,booming then fly 모두 귀를
2430,833027,5,3,17,앓는 사람들 그마저 내겐 부러워
2431,827214,8,5,11,그대 나처럼 하루
2432,827491,2,1,6,feel likei want you
2433,833028,3,16,14,할수록 그리운 그만큼 조금
2434,834230,8,11,12,get to the dance
2435,833030,3,8,12,oh 사랑해 사랑했던 많은 날보다
2436,828263,8,12,13,day think about your smile
2437,833032,6,4,13,주인공처럼 살짝
2438,833029,8,3,17,위한 시를 썼죠 아침까지 사랑한단말
2439,833034,8,7,13,마음은 너의 꿈마저
2440,837567,3,8,11,사랑은 사랑했나봐 잊을수
2441,842022,1,3,18,생각이 같지 않기를 바래 그랬듯이
2442,843729,18,14,13,나도 울었어요 사랑하는 그녀에게
2443,845580,6,11,15,on this track grap microphone
2444,837693,7,3,5,그래요 아직 어려요 사랑을
2445,842624,8,4,13,귓가에 입술에 그대 눈에 내가
2446,838486,3,4,18,전해져 오는 마음이
2447,841111,3,17,18,나를 감싸주는 꿈이 있다면 얼만큼
2448,842024,3,15,14,말고 다시 만나 buen camino
2449,836849,3,7,15,버려진 삶에 뭐하나 마음
2450,844267,10,1,19,장난쳤나요 사랑이
2451,836850,7,1,20,바로 너야 너만 갖고 모두
2452,847132,3,4,18,조금씩 잊혀져가고
2453,847126,3,4,8,사랑을 도려내버린 텅빈 마음을
2454,606748,4,1,17,이상 너는 참나 사랑만으로
2455,845586,7,1,14,thank 고마워 고마워 want love
2456,842585,7,8,11,나의 사랑은 너뿐야 이별도
2457,541002,1,2,18,back whooa whooo like
2458,848146,1,4,13,사랑은 사랑이 지워야
2459,842020,5,6,11,봐요 너무 가까워서 너무 내가
2460,837710,3,4,8,그날부터 사랑했지만 그대는
2461,837685,18,11,12,my love for 1000 years
2462,841073,8,7,11,나를 용서해
2463,845591,3,8,14,홈런이야 이젠 울지마 항상 그대만을
2464,848156,10,9,3,눈물날수록 없는
2465,775217,8,15,13,그녀는요 미안하다는 말을 항상
2466,847269,5,17,13,이런느낌 가진적있니 바라보는것 만으로
2467,842021,3,8,17,나의 기억들을 모두 지워버렸니
2468,848286,7,1,8,힘든거야 hold me now
2469,841509,6,4,13,got the dynamite who am
2470,845577,4,16,13,과거속에 조각일뿐 남은 시간만 생각해
2471,845579,5,8,13,사랑은 뭐야 미칠듯
2472,845603,5,6,11,채로 나를 떠나버린 날도 그때는
2473,835062,7,13,11,내가 tv에 나올 누가
2474,851423,4,17,13,이제 우리는 스치고 지나가는 사람들처럼
2475,851277,18,17,11,늦지마요 소중한 사랑 내겐 누구보다
2476,848804,1,18,12,남겨둘게 나는 너를 못봐도 항상
2477,860577,7,11,15,이러는가봐 너를 잊고 찾고
2478,854321,3,4,18,사랑을 고백했던날
2479,864906,3,4,6,너를 사랑했던 거라면
2480,855659,7,4,11,내리고 she is the girl
2481,855658,15,18,17,같아 can kiss her
2482,848162,3,20,15,괜찮아요 외로울수록 눈물날수록 알수없는 힘이
2483,848677,18,14,17,life music is my life
2484,850977,5,12,11,모두 나를 숭배하는 의식
2485,860582,6,5,4,나는 naughty girl 말을 걸까
2486,844009,4,3,11,사랑한다 말하려 했어 사랑해서 항상
2487,851429,8,3,12,후회하고 있는 그땐 정말 나는
2488,852089,3,14,18,바람에 흐려지는 사라져간
2489,863026,3,7,16,달이 너무 처량해 너도 나처럼
2490,842118,8,12,13,get in before it starts
2491,855662,3,18,14,다시 내게로 와서 곱디고운 꽃노래처럼
2492,864433,7,1,13,나의 뜻대로 나는 나인걸 누구도
2493,854324,1,7,8,몰랐죠 얼마나 사랑했는지
2494,851364,7,1,6,떠나지않기로 나약속할께 baby 오직 너만을
2495,848567,9,10,13,다시 있을까요 고달픈 삶의
2496,847128,5,2,8,inner light 나의 바램은 오직
2497,858982,1,12,15,up all my funky men
2498,8395,1,2,18,you need got now ladies
2499,864907,8,11,12,겁이 만큼 사랑했고
2500,866705,3,15,17,너를 그리워하지 않는 쓸쓸한 일인데
2501,884783,1,12,18,눈빛처럼 사랑한다 말하면
2502,863192,8,13,12,paradise 너를 사랑해
2503,882495,1,2,17,버렸어 마지막 사랑이길 바랬어 하지만
2504,863194,8,3,17,평범한 내일의 꿈들이
2505,864431,3,6,14,길로 watching you 혼동 속에
2506,866706,7,12,14,그녀를 사랑합니다 그래요 바보처럼
2507,864916,3,18,11,네번째 슬픈일에도 씩씩해지길 울지말길 내가
2508,863656,1,2,17,용서할
2509,742312,6,3,18,너보다도 그녀에게 눈길이
2510,884620,3,4,18,눈물을 삼키지 말없이 혼자서 눈물을
2511,858981,2,8,1,사랑이 이루어져도 마음은
2512,882619,5,13,11,음악이 흐르고 사랑해 사랑해 나에게
2513,855665,3,4,18,사랑하지만 보내야 한다면
2514,866710,10,9,0,너를 사랑해 세상이 힘들어도 보면
2515,866707,3,8,15,사랑했어 사랑했어
2516,880927,1,7,12,물어봐 너를 좋아하냐고 나는 항상
2517,888173,1,2,18,눈에 누군가란 맑은 눈물이 흘러
2518,848166,18,13,12,baby 사는 나를
2519,858983,1,4,15,breathe stop rock it on
2520,866711,2,8,13,웃음을 보이면 떠나는 니가 수월할까
2521,833906,5,8,11,what an amazing time what
2522,864434,3,18,12,봐요 my heart 그댈 느낄
2523,866708,3,14,18,너를 안아도 울었어 사랑하기에
2524,858171,8,2,13,me can find no rest
2525,877919,3,5,16,기다릴께 사랑할께 너를 위해
2526,882500,8,7,12,맘속엔 커져만 가는 사랑을
2527,866714,2,1,18,이세상 사랑하기에 나는 행복하니까 구름속의
2528,882497,1,16,20,깊어만 가네 sexy sexy baby
2529,864432,15,11,18,baby do you
2530,864905,3,4,18,너의눈물 나같은 사람 두번 다시
2531,885552,8,1,3,never find someone like you
2532,891991,1,6,15,서로아픔을 같이하면 우리 서로아픔을 같이하면
2533,882501,8,11,17,너를 잊을래 다른 사랑이
2534,863658,2,8,7,baby don wanna love again
2535,864910,3,14,18,웃음을 얼마나 연습했는데 그날처럼 눈물부터
2536,866712,14,13,19,나는 뭐라고 말하니 네가 너무
2537,882496,6,4,1,사랑은 내가 올때까지
2538,864438,3,8,12,treat me so bad that
2539,894063,2,1,5,이제는 욕까지 이상 됐다 싶어
2540,888345,3,4,18,눈감은 내가슴엔 눈물이 기약없는 이별뒤에
2541,891878,1,2,18,언젠가는 커다란 날개가 되어줄테니 나를
2542,897147,9,10,11,다같이 들어봐 hiphop muzik
2543,885477,3,8,4,망설이다 집에가면 나는 뭐야
2544,898497,1,8,12,사랑하고 있을까 너를 사랑한단 숨쉴때마다
2545,889545,1,13,17,자꾸 눈이 마주쳤어 피하려 했지만
2546,897725,2,18,13,서둘러온 초겨울 새벽녁에 반가운 눈처럼
2547,896242,5,1,6,나의 꿈이 흔들려
2548,893830,2,11,18,돌아선 우리 memory 시간은 눈물보다
2549,897709,3,4,17,부비부비 부비부비부비부비 처음엔 모두 부끄럽다
2550,895904,1,16,14,걸음이 축복에 눈부시죠 사랑을
2551,900583,7,8,4,let your gun cry don
2552,898404,1,18,17,눈에 사는 너니까 너를 다시는
2553,897595,18,11,12,let go amp 우린 다시
2554,896673,1,7,12,내리더니 꽃이 폈어요 당신과 다정히
2555,896695,3,4,11,피곤한 사랑이라도 미련한
2556,898410,4,3,18,let go queen bee 손상미
2557,897731,1,19,20,you girl 깊게 들어와 just
2558,897732,8,3,2,joy 아무런
2559,896644,3,8,11,않아도 사랑할 있는 사랑
2560,896667,3,5,17,그래서 이제 부비부비 너도나도 모두
2561,888282,4,17,16,사랑이 이것이 마지막이라는 것을 서로가
2562,601953,3,17,14,너를 사랑했나 죽을만큼 사랑했나 아직까지
2563,892386,6,3,14,sing sing sing 높은 하늘을
2564,840992,1,7,3,정말 우스운 지금
2565,888284,10,9,3,시릴만큼 눈물이 차올만큼 나그대를 사랑합니다
2566,897508,5,1,16,무슨 일이 너를
2567,905857,1,2,17,외로운 사랑해 세글자가 나를 아프게해
2568,905582,5,8,12,끝내고 싶다는 거짓말이란 말야 한번쯤
2569,926191,3,18,17,볼수없는 영혼 속에서 우리의 사랑은
2570,904628,8,13,12,it party time and 사랑이란
2571,899426,3,4,18,fly everybody 모두 떠나보자
2572,928700,8,2,15,this song my for love
2573,899285,3,8,17,니가 너무 사랑해 너를 이제
2574,903404,8,2,11,come on music got this
2575,905587,3,7,18,사랑에 너의 뒤에서 쳐다만
2576,926193,3,17,18,짓는다 외로움이 없단다 우리들의 꿈속에
2577,928697,2,3,8,추억들과 살아도 겨울을 혼자
2578,905581,4,8,13,말을 했다면 예전 그때처럼 나를
2579,899430,7,8,11,진정 너를 사랑하기에 니가 다치는
2580,928698,3,4,18,나만을 사랑한다고 일부러 거짓말했죠 가끔씩은
2581,926199,5,11,18,찌푸린 사람들 마치 그림처럼 행복하면
2582,916286,7,18,14,no here go come back
2583,928699,6,5,4,가끔은 꿈에 다가와 눈을 감은
2584,928702,8,3,1,한번만 너와 바꿀수 있다면 나를
2585,926198,3,8,6,사이가 싫어져 나는
2586,905584,3,18,15,어젯밤 생각이 마치 자장가
2587,916033,8,12,13,사랑한다는 얘기를 사랑해 너의 귓가에
2588,902092,3,14,17,사랑했나봐 죽을만큼 사랑했나봐 아직까지 그리운걸보면
2589,905583,3,8,15,봐도 나는 정말 쉬웠어 울다가도
2590,928042,3,8,17,키스해줄래 쪽쪽 wanna touch me
2591,926192,3,6,18,비에 너의 마음도 울고 있다면
2592,928701,8,3,1,너를 사랑한 기억
2593,889549,7,8,4,너는 벌써 잊었니 어떻게 나를
2594,904640,1,12,18,yeh this song is kyt
2595,928705,3,5,18,잊는다 어렵겠지만 오늘도 너만 사랑해도
2596,905580,3,4,11,났어 어쩔 없어 my lady
2597,905859,3,4,18,밤새워 울고 울어도 커져만 가는
2598,905585,1,12,14,네가 목숨 바치고 나를
2599,928704,10,3,19,후회로 아픈
2600,927045,1,12,14,몸을 느껴 feel me
2601,926197,5,8,13,내안의 사랑이
2602,930037,4,6,3,있는 사람만을 사랑하며
2603,905653,1,6,5,love won you make secret
2604,901159,1,2,8,about me give me dance
2605,905590,1,16,13,웃음이 나죠 늦은 그대를 기억하려고
2606,905586,3,8,15,네가 구긴다면 누가 다시 나를
2607,905579,8,11,12,singing my song
2608,926195,6,5,11,사이로 마음은 어두운 비를
2609,891745,3,18,12,사라져 내가 울기
2610,928703,3,18,15,기도 드림 어둠이 캄캄히 덮으니
2611,926194,3,14,17,사랑 썰물이 되어 너무도
2612,926200,3,4,18,날을 위하여 사랑이란 사랑이라는 마음만으로
2613,905858,8,5,13,너무 많은데 나는 눈물밖에
2614,933372,1,15,12,잔인한 세상은 너를
2615,931286,1,8,14,너를 사랑해서 아파해서 정말
2616,971439,8,4,13,써놓고 이제 나를 망부석 여인처럼
2617,931730,5,16,18,me up 내게로 jumpin jumpin
2618,929889,4,1,7,두렵나요 만큼 내가 못됐었나요
2619,976103,13,16,11,너만을 원해도 사랑은 태초부터 하나가
2620,933390,3,4,18,나에겐 전부인데 더이상 울지 않을께
2621,979393,9,10,18,get movin let get dancing
2622,931957,8,5,14,너없이 무너질 나를
2623,930974,3,4,8,기도할까요 서로만 사랑하도록
2624,928706,4,3,11,이상은 힘들어 그랬는지 시작조차 후회를
2625,933934,6,11,18,하나의 사랑 추억만으로도 있다면 오직
2626,930739,3,4,17,환하고 젊은 나는
2627,979391,10,9,0,노래나 할까요 잘할 있었는데 it
2628,931222,3,4,18,하네요 눈물없이 보내려 보면 눈물이나
2629,931726,1,18,12,everything seems shallow god
2630,975978,8,13,12,아니겠죠 사랑이란 느낌 마음 모두
2631,926116,4,1,12,now let get dance moving
2632,933931,3,14,18,마음이 네게서 사는
2633,928709,8,3,4,서서 사랑 말을
2634,930038,3,18,14,없어요 밤을 밤을 다시 당신과
2635,928707,8,2,11,in the morning wish you
2636,930977,10,9,13,너무 상쾌해 속에는 장미
2637,928710,8,1,2,show is all over alone
2638,852759,1,6,12,계속 있어 마치 풀려버린 시계태엽처럼
2639,931066,3,18,17,슬픈 얼굴만 좋은 사람 만난
2640,928708,8,5,3,몰래 말해 sexy my
2641,916287,5,6,18,니가 없는 낯설기만 아직 사랑하는데
2642,916295,5,13,11,모두 비워도 비워도 주체 없이
2643,985785,8,2,11,ok ride with you slide
2644,928711,8,1,12,만큼 나는 바보였는데 모자란 너무
2645,933388,8,7,3,지금부터 시작되는 나의 beat 삶이라는
2646,933932,8,2,1,나를 찾아온 다른 사랑 이번
2647,932539,6,1,5,귀찮기만한데 어떻하나요 한걸음 나의 자릴
2648,933933,3,8,17,슬픔의 눈물 ooh 왜일까
2649,979392,8,13,11,let move 모두 잊어가 sexy
2650,978136,2,1,5,너만 탓하고 투정만 부린 사랑은
2651,985472,1,7,8,나를 속이는 것만 같아도 나로서는
2652,986817,8,2,11,사람 사랑하나봐 나는 몰랐어 내가
2653,1008495,1,12,16,없다해도 고운 사랑아 나를
2654,983664,8,7,11,내겐 없어요 이젠 지쳤나봐요 사랑도
2655,985474,6,5,3,다시 사랑할 없다면 너무
2656,985739,3,4,11,alright it so wonderful world
2657,993956,7,1,18,bye 사랑했지만 my love 보고
2658,992526,3,5,18,자라지 않게 마음이
2659,987332,8,1,17,다가가면 뒤돌아 뛰어가고 쳐다보면 하늘만
