,song_id,emotion_1,emotion_2,emotion_3,key_sentence
4439,2511579,3,4,18,멀어지려 해보지만 벌써 늦은거 너무
4440,2513619,7,1,8,너를 만난 그날 오후처럼 예쁜
4441,2512058,8,5,11,boy this is love story
4442,2366787,1,2,16,wanna break this horrible christmas
4443,2363261,8,2,13,busy sorry cannot hear you
4444,2508660,3,8,5,처음인듯도 답답한 시간만 헤어짐을 숙제처럼
4445,2517998,3,8,11,만나자 사랑해 사랑해 사랑해 사랑해
4446,2320882,6,5,13,mystery mystery mystery 알다가도 모르는
4447,2373796,10,9,3,삶이란 시련과
4448,2380211,5,8,12,사랑해 기대하면 수록 안의 상처만
4449,2326351,8,5,11,않냐고 hey my jo jo
4450,2368658,1,2,15,화장 얼굴 evelyn you
4451,2384175,3,14,18,miss you my girl oh
4452,2356542,1,12,18,나를 보면 어떤
4453,2377098,8,3,14,이상 사랑은 없다고 사랑했었는데 전부였었는데
4454,2377775,8,17,14,크리스마스에 눈이 내리면 사랑이 이루어진다고
4455,2529931,2,1,15,어려도 you can change 누가
4456,2534748,3,4,18,사랑은 유행가보다
4457,2540268,8,6,13,oh know your mind 이미
4458,2523763,7,8,2,있죠 그녀뿐이면 아니면 나를 버릴
4459,2549955,8,7,3,살겠어 그래서 죽어도 보내 내가
4460,2537461,7,8,14,tik 니가 나를
4461,2517654,8,11,12,presents you know why cuz
4462,2535055,3,4,18,없다 해도 어찌 너를 잊을까
4463,2546258,3,14,18,너를 지워 잊는 법은 안가르치고
4464,2554001,2,8,5,dance till we run this
4465,2542751,6,1,12,다른 맘이라면 나완 다른 이라면
4466,2549956,8,1,12,내가 그랬던 내가 너와 더이상
4467,2537463,3,4,18,사랑이 그렇습니다 너무합니다 모든 줬는데
4468,2544949,3,18,14,아무리 병을 비워도 너만 생각해
4469,2537575,1,5,12,겁내지 말아요 우리 꿈처럼 설레는
4470,2535554,3,4,18,버려도 사랑하면
4471,2540358,7,1,18,내가 사랑한 사람이
4472,2549957,8,2,13,you love you want you
4473,2511767,5,11,12,나는 대답해 손엔 두잔의 라떼
4474,2388949,7,13,11,축구공 come on everybody sing
4475,2549958,3,4,18,사랑하고 싶은데 이예 너에
4476,2517760,9,18,20,고달프지만 희망이 있다는 그것만으로도 내겐
4477,2537464,7,1,16,가지마 마지막 사랑 너란 아니까
4478,2530641,8,7,11,오늘은 잊을래 한번쯤은 소리쳐 세상을
4479,2542649,7,12,14,and know you love me
4480,2555764,11,12,13,구름처럼 커진 마음 그대는 솜사탕
4481,2533327,6,11,15,japan girl 365일 춤만출래
4482,2516879,8,3,11,그랬나봐요 몰랐어요 사랑에 미치면 사랑
4483,2530638,5,18,13,행복하고 내겐 슬픈 노래
4484,2552034,8,5,13,한숨도 지독한 그리움
4485,2335460,7,3,8,원한 마음이 falling love again
4486,2549796,3,4,18,정말 사랑했다면
4487,2530643,3,7,18,사랑이 예뻐질까요 생각을 하면
4488,2530642,6,11,18,꿈들은 어디로 사라지고
4489,2552016,7,3,8,사랑했었냐고 웃으면서 대답해 잊혀진 사람이라고
4490,1935298,8,2,5,생각했어 너와 만난이후로 변한것
4491,2566853,7,8,15,돼요 사랑이 나를 미워해 아픈
4492,2572678,8,5,12,quick follow me 따라
4493,2558735,3,4,17,울어 어떡해 몰라 어떡해
4494,2566835,6,1,15,운명인걸 사랑을 나는
4495,2542748,8,5,3,사랑이다 인형처럼 있는 사람들 중에
4496,2558729,9,10,15,아직도 모르겠니 show me show
4497,2579459,1,15,16,sing it with me now
4498,2569008,1,14,17,죽는것보다 내게는 힘든 사랑이라서 기다림도
4499,2558448,3,15,11,너를 위한 사랑이 이렇게 힘들게
4500,2575585,1,18,14,돌아와요 우리 사랑 불쌍하니까 언제쯤
4501,2572448,5,1,12,너만 사랑해 언제라도
4502,2569048,2,1,18,새를 닮아 떠난 사랑아
4503,2584058,1,15,12,goes lolli pop you got
4504,2573848,3,4,16,사랑 경험이 많은 사람이라면
4505,2565275,5,11,20,you ready kiss brave sound
4506,2558730,1,2,17,사랑이란 시시하게 느껴져 쉽게
4507,2565248,5,7,12,누군가 자꾸만 낯선 사람의 느낌은
4508,2558731,5,8,16,가난해진 마음이 빛을 찾았어 영원토록
4509,2558733,3,8,16,화성에서 하고 있어 니가
4510,2587788,7,6,11,망가질듯이 너는 make me crazy
4511,2558732,2,8,11,말해봐 boys girls be happy
4512,2578965,3,14,18,종일 너를 그려보다가 나를
4513,2553760,3,4,18,지쳐도 포기 할순
4514,2558734,5,7,13,싶은데 나의 마음속의 그대는
4515,2579850,5,8,2,open up some happiness eh
4516,2530461,8,5,2,blow my speakers uptonight
4517,2581291,8,3,1,너만 사랑했었어 마음
4518,2585956,3,4,8,no more drama 보란 듯이
4519,2558737,8,2,13,내마음도 니맘처럼 사랑으로 채워넣을께 크림처럼
4520,2558736,10,9,15,꿈에서 나타난 니가
4521,2563148,3,4,18,지옥 같은 어둠이 나를또 같은
4522,2579716,1,2,18,멍청한 알면서도 사랑
4523,2586103,3,4,18,고백 my destiny 하루만이라도 나를
4524,2596161,1,19,15,5분만 this sweet bubble love
4525,2593649,5,1,4,일상이란 깨어있지만 속을 헤엄치는 기분
4526,2593618,8,5,12,loneliness my love so beast
4527,2596063,3,6,18,다른 사랑은 못해 너를 사랑해
4528,2590566,3,8,14,해서 불행합니다 다시 후회합니다
4529,2601592,9,17,20,생애 가장 아름다운 순간은 만나
4530,2611648,5,1,16,devil devil you better run
4531,2609744,2,8,5,hurt me why are you
4532,2601848,3,14,18,지운다 사랑이 올까요 다시 올까요
4533,2600849,8,1,16,run run run away 아무리
4534,2590471,7,15,18,사랑의 멜로디 순간 나는
4535,2598413,8,1,13,사랑은 사랑은 끝난 거야 사랑한다
4536,2604975,2,1,7,잊으라 하지 말아요 가슴 아픈
4537,2590549,1,6,2,못해 스치듯 떠난 너를 돌아서는
4538,2588847,1,5,16,you need you love you
4539,2603649,5,11,12,심장은 너무
4540,2605215,4,1,17,살아가도 되겠니 사랑이란
4541,2612451,3,8,17,눈물 흘려도 사과나 동정 하려는
4542,2595563,8,11,13,번씩 고백해줄래 사랑한다
4543,2612175,6,3,14,special wanna love you kiss
4544,2587789,3,14,17,정말 몰랐어 정말 아파와 마음이
4545,2588796,4,1,12,눈물만 흘러 꺼져가는 사랑에
4546,2609656,3,4,18,your boy dconn this song
4547,2596061,8,3,7,어떡해 어떡해 in my head
4548,2621364,8,13,15,do it now ha ha
4549,2588963,3,4,18,사랑이 너무 아파 외면하려
4550,2612766,5,13,18,you move like the way
4551,2621349,8,3,17,나를 떠난 너인걸
4552,2593650,1,12,16,아주 옛날 옛적 이야기
4553,2617550,3,1,14,기다리다 미쳐 사랑하다 지쳐
4554,2605917,3,15,16,눈물은 너를 기억하잖아 come back
4555,2579460,6,13,18,my luv 너만 보면
4556,2593756,1,8,13,나를 잊겠다며 흐느끼는 너에게
4557,2596149,8,2,15,보이니 ooh babe 니가
4558,2595959,3,4,18,me 항상 이렇게 사랑해라고 말해줄래
4559,2566458,11,17,16,너는 내가 사랑하니까 소중하니까 오직
4560,2617540,8,7,5,너때문에 어젯밤 일은 내가 미안해
4561,2605837,10,9,0,나는 몰라 세상이 아름다워 마음은
4562,2626610,3,4,8,나는 어떡해 어느덧 떠나간 너의
4563,2629049,1,15,16,불러봐 we are magic
4564,2623007,5,8,11,목소리 나도 몰래 목소리 따라가
4565,2640165,1,7,8,없어 어차피 나는 혼자 떠드는
4566,2627748,7,1,18,너만 보여 말도 안돼 나도
4567,2627950,3,4,17,사랑하니까 다시는
4568,2637292,6,5,1,사랑은 어려워
4569,2620650,7,3,11,들을 있어 mad my soul
4570,2626713,1,2,8,my heart breaker dj yg
4571,2630748,3,4,8,슬픈 음악이 흘러 흘러
4572,2633352,2,1,17,내가 너에게 달려
4573,2634099,9,10,1,소리 째깍째깍 리듬 맞춰
4574,2626611,2,8,5,yeah this is hip song
4575,2648642,8,1,7,줬어 너를 믿었기에 모든걸 줬어
4576,2610672,8,2,15,go beautiful girls all over
4577,2625085,6,17,14,나는 꿈을 믿어 조금은 더딘
4578,2627749,3,4,17,기도했어 흐르는 눈물보며 떠날수가 없는데
4579,2643809,6,3,5,알게 진짜 사랑이란 어떤 맛일까
4580,2646465,7,3,18,can fly 나의 날개
4581,2637971,1,2,18,사랑이 죄겠니
4582,2633252,8,6,15,사랑일테니 만난 날처럼
4583,2634967,5,8,13,나의 사랑을 비가
4584,2632716,4,3,18,music makes me high 바라봐
4585,2621350,18,17,15,다가와 feel your love
4586,2650539,3,4,18,사랑이 떠나간 후에 빗물처럼 니가
4587,2646084,1,5,12,ho ho ho 으리야 desperado
4588,2641053,1,2,13,달콤한 lie lie
4589,2643725,3,4,18,아파도 다시 사랑할래 사랑할래
4590,2643659,16,18,14,bye good bye my princess
4591,2651832,8,3,14,사랑은 오직 그대 뿐인 바보같이
4592,2641058,5,8,2,속삭여 want you baby
4593,2660148,8,3,11,그저 사랑 한단 한마디
4594,2670748,3,4,17,와서 니가 나를 버릴 없어
4595,2667293,5,11,17,yeah mysteric mysteric 몰라 몰라
4596,2627301,3,18,14,달은 내게 오라 손짓하고 귓속에
4597,2671449,8,12,13,boo 심장이 boom 너에게 나를
4598,2654948,1,6,15,love is lie 마음을
4599,2684572,3,4,18,love you so hate you
4600,2667088,3,4,0,두렵죠 하지만 이번 만큼은 사랑이라
4601,2680552,3,8,12,이미 다른 사랑 있다해도 다시
4602,2654264,9,10,3,살아요 아이같은 미소로 나를 보며
4603,2673348,8,13,17,너를 사랑한다는 아무리 소리쳐도 귓가엔
4604,2676935,18,11,16,어느 날에 그대의 목소리는 나를
4605,2656760,3,17,14,시간이 너를 지워도 사랑은 지울
4606,2671461,4,8,3,바보처럼 길잃은 아이처럼 참았던 눈물만이
4607,2673793,7,8,15,누가 전해줘 my baby
4608,2680150,3,4,18,나홀로 남아 덩그러니 눈물은 그렁이
4609,2688949,8,16,15,humph huh huh huh huh
4610,2656792,7,5,11,당당히 인생엔 무서 우리만큼 사랑엔
4611,2675871,12,15,18,수놓지 genie for you girl
4612,2680287,8,13,15,부드런 목소리로 귓가에 달콤히 사랑한다고
4613,2684461,8,13,11,어쩔 없어 give to ma
4614,2674754,6,1,12,두고 cry
4615,2682148,3,8,11,사랑은 변하지 않을께 하늘은
4616,2670153,1,2,7,이런 비린내 나는 사랑 이제
4617,2678848,8,17,11,사랑은 아니라고 해도 힘든 이세상
4618,2674873,8,5,13,보이나요 나에 사랑이 들리나요 심장이
4619,2656848,3,7,18,사랑한다 할까요 사랑해달라고 할까요 그래도
4620,2679548,6,20,11,mis oh mistake everybody
4621,2670548,5,8,3,you love is just game
4622,2665561,8,5,17,알았지 사랑을 몰랐었지 so sick
4623,2671214,1,8,2,사랑을 몰랐어 니가 너무 그리워
4624,2686250,3,4,8,웃고 있지 행복했지 사진 속에
4625,2668648,2,11,15,it shake it baby shake
4626,2657048,3,4,16,살수 있었던 시간으로 돌아가듯이 이제
4627,2669850,7,8,4,니가없이 내가 어떻게 살아
4628,2682571,9,5,20,나는 익숙치 않은걸 어떡해 니가
4629,2675248,1,13,18,기대 마저도 우린 결국 제자리
4630,2667086,3,6,4,you 눈물이 나는 이유 울어야
4631,2664550,8,3,15,몰랐어요 결국 이런 사랑 미련했나요
4632,2687986,2,18,15,cry baby don cry 그대
4633,2666648,8,5,12,kiss ok kiss again yeah
4634,2662283,5,8,13,everybody shake shake wanna shake
4635,2650540,3,8,17,편하다면 기다릴게요 하필 사람 사랑했었나요
4636,2660751,9,8,13,울면 우리 사랑도 우니까 나를
4637,2645549,7,2,11,나만 울어 너는웃어 나는 울고
4638,2690353,3,4,18,가지마 가지마 가지마 소리쳐 사랑해
4639,2648948,8,7,13,싫어 나는 쓰러질 수가
4640,2671560,3,18,17,니가 없는 세상은 살기가
4641,2652027,1,6,12,can we pretend that airplanes
4642,2705410,10,9,13,잔소리 그만하자 그만하자 사랑하기만해도 시간
4643,2703101,1,2,18,눈을 감아 버리고 내마음을
4644,2697459,2,11,18,love with you forever why
4645,2692754,1,6,2,let go this song is
4646,2703064,3,14,18,너와 만든 기념일마다 슬픔은 나를
4647,2702486,4,16,13,내봐 너라면 있어 너에게
4648,2705407,6,13,11,push baby oh push baby
4649,2707218,9,10,0,짧은 몇마디에 남이 있나요 사랑했다면
4650,2702748,8,5,11,이해가 안돼 웃지마 웃지마 울지마
4651,2705414,8,11,12,louder throw your elbows up
4652,2705374,1,3,18,사랑이 너의 이별보다 한걸음
4653,2697563,1,12,17,맘속에도 나만 살길 다른사람
4654,2714048,7,3,8,나를 사랑했냐고 우리가 끝난
4655,2710203,1,12,18,gone 너무 아파 너에게 사랑이란건
4656,2695273,3,14,17,나의 사랑이 아직도 너를
4657,2722445,8,2,15,go beautiful girls all over
4658,2712448,7,6,1,너는 나의 기다림에 끝이야 지우려
4659,2702751,3,4,17,후에도 낮이 아냐 이별도 사랑이라고
4660,2705548,8,2,11,사랑해 사랑해 사랑해 아무리 막으려해도
4661,2718655,6,5,1,kiss your touch let dance
4662,2728048,5,7,2,turn it up loud 랄라라라
4663,2720569,3,5,11,몸은 이제 버티질 못해 어디서부터
4664,2707237,4,8,3,내가 너무 싫었어 너없이 있을까
4665,2690496,5,6,1,이순간은 crazy summer caribbean oh
4666,2709156,5,3,18,이별후유증일까 모르겠어 내가 어디를 가는지
4667,2690495,3,14,18,있었어 궁금했어 정말 사랑 했는지
4668,2719448,3,18,14,우리 사랑이 끝났다는
4669,2680562,8,5,13,쉬워보였니 미친거니 사랑할 언제고 미친거니
4670,2725948,3,8,14,정말 사랑했어요 love
4671,2702648,10,9,1,제육볶음 맛있다 맛있다 맛있다 아무리
4672,2710548,7,1,13,감으면 kiss를 해주세요 영화처럼
4673,2690268,5,1,17,you can sing with me
4674,2719683,7,8,11,뚫어져라 쳐다보면 어떡해 어떡해 내가
4675,2698848,8,3,7,사랑인걸 느껴
4676,2689256,8,3,16,사랑해 두번다신 볼수없나요
4677,2713099,8,2,11,break it up it gonna
4678,2733249,8,2,11,채우고 don leave let me
4679,2693848,3,4,17,darling darling darling oh honey
4680,2677347,3,8,2,bang bang 바로지금 shout
4681,2689049,10,9,6,love 두근대는 oh my girl
4682,2730675,4,3,17,사랑은 너여야만 하니까 나의 가슴은
4683,2698436,8,4,3,너를 그리워 하는 내모습 사랑
4684,2715365,3,4,18,멀어지는 힘겨운 삶에 느린걸음 한걸음씩
4685,2741416,17,11,18,me so shut off boy
4686,2741566,5,11,16,얼굴 보자마자 내가 샀으니까 니가
4687,2741397,2,7,5,싶은 사람 girl need girl
4688,2738241,6,5,8,온다면 쯤이면 웃을 있을까 다시
4689,2742586,3,14,18,love want fade away 내가
4690,2748528,7,5,1,you wanna 이제 wake up
4691,2743254,8,7,13,fall in love 두렵진
4692,2746858,5,1,2,back 삐리빠빠 삐리빠빠 빼리빠빠 삐리빠빠
4693,2688951,7,1,12,stop 모두 나를
4694,2741360,7,8,6,미쳐 버렸어 내가 미쳤어 내가
4695,2757170,8,2,15,nothing on you baby they
4696,2735077,3,14,17,사랑하다 마음을 베어도
4697,2730687,8,3,12,다시 만나지않기를
4698,2759655,3,4,18,지워갈게요 어느날엔가 내눈물이 마를때 까지
4699,2759748,3,14,18,행복해 니가 버린 사랑 니가
4700,2735380,6,11,15,찾니 너같이 좋은 사람 너같이
4701,2745357,8,5,3,나만의 사랑 baby
4702,2741349,4,3,8,사랑해 하늘이 허락 못해도
4703,2753448,3,18,17,곁에 있는 사랑해도 사랑해도
4704,2749077,3,14,16,몸부림쳐 울어도 사랑해
4705,2735074,3,1,8,사랑할바에는 죽도록 사랑하자 사랑을
4706,2733251,1,5,6,love is gone 나는
4707,2746256,5,18,12,chance stop lovin you gimme
4708,2758736,3,4,18,기다려줄 인줄만 알았던 자만을 용서
4709,2756971,8,7,11,버린 너야 기다리며 울며 불며
4710,2768149,3,1,7,묶고 가둔다면 사랑도 묶인
4711,2763048,3,1,18,사람은 많이 사랑했었는데 바보처럼 내가
4712,2756526,7,5,11,your side like sunday baby
4713,2769458,1,6,15,shake it shake it hey
4714,2759248,4,3,8,내게 심장을 찾아준 사람 사랑
4715,2745604,8,5,11,못된 남자야 나는 좋은 사람
4716,2772064,7,1,4,바라봐 feel me feel me
4717,2745181,7,12,18,사랑한다 말해 보면 자꾸
4718,2750579,1,4,2,feel so good baby
4719,2751174,8,12,13,miss 이번 우리 위기는
4720,2752212,1,2,15,어쩔수없어 사랑은 집행유애야 집행유애 나처럼
4721,2712350,1,3,12,다시 기회를 없이 나는 수가
4722,2766948,5,8,2,superstar 오직 나만을
4723,2742716,3,6,1,나는 별의 별놈
4724,2776748,3,18,14,일들에 아까운 눈물
4725,2788757,2,5,7,hurricane uh uh venus 자극하면
4726,2783260,10,9,11,별들도 웃곤해 사랑해 사랑해 세상
4727,2793051,3,14,18,떠나가 너만을 사랑해 정말 미안해
4728,2792665,5,11,16,너를 잊을수있니 웃음만 웃음만 웃음만
4729,2782368,5,2,18,come play with me 천천히
4730,2797558,5,17,18,donna donna 모두가 hot hot
4731,2782665,8,2,11,사람이었다니 쉽게 부서질 모래성같은 사랑이었다니
4732,2788462,8,6,3,모든 사랑이 가득하길 이밤 귓가에는
4733,2801290,1,2,14,please don cry uh uh
4734,2801651,7,5,12,사랑스러워 나의 애기야 너무 귀여워
4735,2773066,8,15,17,울고 싶어서 심장이
4736,2772063,15,18,11,bounce digital sound digital welcome
4737,2783156,5,17,11,dj play this song
4738,2795074,8,2,13,하다가 사랑해선
4739,2774965,7,3,4,너만 보고있는 나를
4740,2803451,3,4,8,있길 just collection line ez
4741,2791103,8,12,13,나를 보내지마 나를 잡았던 놓지마
4742,2802840,7,8,14,거짓말 나만 사랑한단 하지마
4743,2769950,5,6,11,hey dj don stop
4744,2901845,9,10,15,자의 감정 so hot in
4745,2898721,1,2,18,쉽니 그렇게 만만하니 웃기지 사랑한단
4746,2896555,3,18,15,마지막 사랑이죠
4747,2896740,3,4,11,너무 오래된 기억이지만 항상 나에게
4748,2897689,5,18,13,you thank you and love
4749,2788463,7,12,15,곁에 있잖아 번만 jump jump
4750,2900275,8,7,12,be ll be there girl
4751,2897374,3,4,18,눈물나게 하는 사람 사랑
4752,2805680,1,15,17,말이야 don want no playboy
4753,2756660,5,1,16,club get that bodies rockin
4754,2783248,3,7,18,사랑하지만 떠나야 한다고
4755,2785700,4,8,11,다행이네요 나를 사랑해주는 사람 오직
4756,2771922,5,18,13,보지 못하네요 사랑해요
4757,2793964,3,16,18,love lover 나는 그대의 조각입니다
4758,2795100,13,18,14,사랑할 있다면 다시
4759,2772351,1,2,3,눈물을 먹고 자라는 마음
4760,2752779,3,4,18,cla clap mad man 끝낼
4761,2900010,3,17,18,다가설수록 눈물겨운 사람아 사랑한다 사랑
4762,1757006,4,1,18,않는 끝없는 꿈을
4763,2901993,9,10,14,햇살보다 눈부셔 나는 우는
4764,2795648,1,2,8,dangerous experience 힌트를 주자면
4765,2804028,8,3,4,마음이 사랑을 따르니 내가 있나요
4766,2908515,8,2,15,again sistar second single
4767,2783249,1,4,16,사람들은 자꾸 내가 떨어지길 바래
4768,2796789,6,3,18,사랑하자고 마음을 흔들어 놓고 미안하다고
4769,2796983,3,4,8,아프잖아요 이해 못하면 슬프잖아요 터질
4770,2793798,1,15,12,she back oh she back
4771,2906349,3,18,14,사랑 사랑 사랑 잘가요 사랑
4772,2903041,15,18,17,hellow hellow hellow 걱정 말고
4773,2910952,1,14,12,luving 사랑하다 너만
4774,2930967,5,11,13,my world 아름다운 seoul
4775,2930968,1,2,18,누가 누구랑 헤어져 네가
4776,2924048,8,11,14,don tell me lie 곁에
4777,2930969,8,13,12,모두 박수 네가 어디에서 무엇을
4778,2930971,8,14,11,계속 사랑할 없니 끝인 거니
4779,2933662,3,8,12,그랬어도 헤어지진 않았을텐데 그땐 그랬을까
4780,2940474,4,8,3,사랑해 말을 하러 가는 마음이
4781,2925029,3,4,18,사랑은 끝났다 눈물도 끝났다
4782,2930972,12,11,15,down now woah woo woah
4783,2928874,3,18,14,너무 빠르게 흘러요 우리 함께
4784,2801292,8,2,5,never find girl like you
4785,2919565,5,3,16,내게로 워우워우워 oh baby girl
4786,2919003,1,20,19,매일 사랑해 나만 사랑해
4787,2923570,7,8,11,바보같은 사랑은 못나 결국 상처일텐데
4788,2914957,8,3,11,돌아올 수는 없겠니 많은 시간이
4789,2943430,6,15,18,사랑인줄 정말 몰랐어 사랑해
4790,2917440,2,1,18,me hold me show me
4791,2907204,8,3,12,painful your love is pitiful
4792,2937988,8,3,15,사랑아 사랑했던 마음
4793,2944387,3,16,11,시작해요 love love love story
4794,2943720,10,9,13,사랑해 사랑해 찾았다
4795,2944162,4,11,18,사랑해요 말하는
4796,2929086,10,3,14,눈꺼풀 달콤하게 깨워주는 너의 한마디
4797,2916590,1,8,17,미안해 사랑
4798,2944748,3,4,18,나는 대답했어 다시 같아서
4799,2931072,18,12,20,gonna make you smile 깜짝
4800,2936289,8,7,11,잊을 있을까 했는데 그게 마음처럼
4801,2921860,8,13,17,망설이지마 my girl iwi iwi
4802,2939099,8,3,15,멀리 퍼져 가는 꼬마들의 숨바꼭질
4803,2944381,6,14,0,뛰잖아 내눈엔 너만 보여
4804,2910953,3,6,14,겁이나고 겁이 날수록 보고싶고 사랑할수록
4805,2183857,8,2,13,let myself cause my heart
4806,2908275,8,3,15,무슨 인연인지 보면 볼수록 가슴이
4807,2937631,10,9,15,안녕하세요 baby ba baby mic
4808,2925863,9,7,18,흔들려 hi bi ye hi
4809,2930973,8,12,15,never let you go oh
4810,2942674,10,6,11,흐르면 곁에 있을까 있을까 얼마나
4811,2919019,5,18,17,bye 애원 해도 마음은
4812,2948449,3,4,8,no oh oh can breathe
4813,2951700,3,15,11,soul miss baby 내가 잘못
4814,2949854,6,11,18,따뜻한 눈빛은 여전하네요 이제야 봤나요
4815,2948248,7,8,15,너를 버릴래 가지마 나를 떠나가진마
4816,2960448,1,2,18,너의 걸음 kill me
4817,2951631,1,8,17,누가 꼬집어 줬으면 꿈이라면 나를
4818,2967751,1,15,18,oh oh 내가 택했던 그녀를
4819,2952163,3,6,14,언젠가 그녀 손을 잡아 올까요
4820,2954935,3,14,18,사랑해 사랑해 말이 들리지 않니
4821,2960543,3,8,17,먼저 나를 떠나갔듯이
4822,2962948,8,5,16,나보다 사랑 없기에 갑자기
4823,2952363,8,11,13,꺼져 it too late
4824,2947165,5,6,18,mr perfect 나를
4825,2950925,3,18,17,언젠간 식듯이 감기처럼 춥고 열이나는
4826,2949405,3,14,18,일생 동안 뿐인 나의 인연일까
4827,2963061,8,2,15,눈에는 모든게 아름다워요 눈에는
4828,2953678,3,7,18,용서해주세요 사랑해요 사랑해요 표현이
4829,2979490,2,1,18,coming back hello 남의 떡이
4830,2967768,1,6,5,너무 어려워 사랑이 우스웠고 이별도
4831,2972778,1,2,18,살아가다 서로 닮은 우리 사랑하다
4832,2967753,1,4,8,없어도 사랑이란 하늘을 나는 그대
4833,2960456,3,8,4,사람과 세상에 모든 사랑
4834,2951898,6,4,13,갈래요 끌어안고 갈래요 서로에게 서로라면
4835,2987448,8,15,13,trouble 나를 노렸어 너는 shoot
4836,2964185,5,3,18,내가 미워 울지않을래 울기가 싫어
4837,2951008,2,8,11,boom boom shake shake shake
4838,2949425,8,13,14,게워지는 울음끝에 내가 한참을 길을
4839,2974750,8,3,17,오오 너는 나의 사랑 너는
4840,2970574,8,12,11,너를 붙잡지 못한 나만 손해인데
4841,2969364,8,12,11,you my baby ayyy girl
4842,2979880,1,2,18,너를 기다리는 아무리 아무리 비참해도
4843,2964477,3,4,17,덮고서 잠들어 있지만 서글픈 꿈꿀
4844,2969981,6,5,13,이름은 숙녀 이것은 분명 나의
4845,2963520,3,7,18,하루 그렇지만 나의 마음
4846,2951356,3,17,18,나에겐 사랑이다 떠났지만 지금
4847,2671181,1,15,18,oh oh 내가 택했던 그녀를
4848,2973753,7,3,12,사랑해 그래도
4849,2968426,1,2,8,터질꺼야 이제는 shot 놓지 않아
4850,2951390,1,2,8,해도 지금 만큼은 듣질 않아
4851,2954475,8,13,14,미안했어 잘가 잘가 사랑하지마
4852,2970597,3,14,0,반지에 눈물만 떨궜죠 어둠속 외로운
4853,2980912,7,1,12,나는 쓰러지지 않아 인생은 칠전팔기
4854,2978062,1,5,16,oh ye can stop
4855,2965596,1,6,2,my sweet delight my my
4856,2953683,4,3,18,그대만이 마음은 아프지만 조금씩
4857,2989873,3,4,16,지우지 이렇게도 아름다운 세상
4858,2979881,3,4,18,눈물이 나는 입으론 잊었다 말해도
4859,2983513,1,2,18,love with oh no 이제는
4860,2965706,7,4,8,내게 기회가 온다 눈을 피하지마
4861,2951511,5,13,17,사랑해 대신
4862,2953681,3,5,1,가빠지는 걸음 따라온 햇빛에 마음이
4863,2953682,3,7,18,그대가 필요한 사랑을
4864,2988848,8,17,11,너에 대한 마음은 사랑해 미워하는
4865,2959740,10,16,11,따라해 내가 노는것만큼만 놀다가면돼 너는
4866,3006873,9,10,0,울지도 않아 모든 바쳐서 사랑해
4867,3013948,3,4,18,jumpin up only you jumpin
4868,3000984,3,18,14,눈물 오가는 많은 사람들
4869,3018898,3,14,18,사랑합니다 여자는 열심히 사랑합니다
4870,3014305,6,2,11,girl this is my confession
4871,2994361,1,12,18,늦었지만 니가 전부라고 바보처럼 몰랐어
4872,3028777,18,17,12,그대는 나만의 사랑
4873,2998356,5,18,13,우리가 다시 사랑한다면 많은 사랑
4874,2990826,3,1,12,까짓 아픔쯤 상처 수만큼 사랑했다는
4875,3006849,16,14,18,바래 좋은 사람 만나기를 이상
4876,3009049,3,8,17,탓이겠죠 사랑한 죄보다 나쁜 그녀
4877,3003430,5,13,16,아무래도 그녀인 같애 그녀는 flower
4878,3016077,1,12,18,지독하게 아파 나는 너를 자꾸
4879,2993798,8,3,17,사랑은 이별보다 아파서 눈에 멀어져도
4880,3016180,3,4,17,너만을 사랑해 wanna
4881,3025148,3,4,18,잘생기면 다야 징글 징글 징글
4882,2996557,8,1,13,사랑했다면
4883,3026177,3,8,14,목소리 그게나의 희망이었어 마른하늘을 달려
4884,3008110,8,1,13,아픈 사랑 하다 휴지버리듯이 버려져
4885,3023048,1,3,18,대신할 사람 찾을수 없어 미워할수록
4886,2994378,8,6,17,다시는 울지마 사랑에 울지마
4887,3026090,8,2,13,let myself cause my heart
4888,3018858,4,8,13,바보라면 그대만 아는 바보라면 나는
4889,3035311,3,15,11,머리에서 지워지라고 사랑해 너만을 사랑해
4890,3009044,3,4,7,거야 we are the dreamers
